date,title,link,location,description,en_title
16.11.2017 05:40 Uhr,Mörder von Karin RIECK gesucht – Polizei bittet um Mithilfe,https://www.berlin.de/polizei/polizeimeldungen/pressemitteilung.648896.php,Ereignisort:Steglitz-Zehlendorf,"Gemeinsame Meldung Polizei und Staatsanwaltschaft Berlin
Nr. 2594
Bei der Suche nach dem Mörder von Karin RIECK bittet die Polizei um Mithilfe. Am 27. Oktober 1992 war die damals 50-Jährige von ihrem Lebensgefährten tot in ihrer Wohnung in der Berner Straße in Lichterfelde aufgefunden worden. Die Frau starb infolge eines Kopfdurchschusses. Die Ermittlungen in den letzten 25 Jahren führten nicht zur Identifizierung des Täters, geschweige denn zur Klärung des Tatmotivs.",Killer wanted by Karin RIECK – police ask for help
01.10.2017 08:26 Uhr,Toter im Park – 1. Mordkommission bittet um Mithilfe - 5000 Euro Belohnung,https://www.berlin.de/polizei/polizeimeldungen/2024/pressemitteilung.1455142.php,Ereignisort:Steglitz-Zehlendorf,"Gemeinsame Meldung Polizei und Staatsanwaltschaft Berlin
Nr. 2251
Mit der Veröffentlichung von Bildern bittet die 1. Mordkommission um Mithilfe. Bei dem Toten, der am Freitag, den 8. September 2017, in den frühen Morgenstunden in einem Park in Steglitz gefunden wurde, handelt es sich um den 47- jährigen wohnungslosen Klaus JÜTERBOCK, der eine Woche zuvor mit seinem Hund aus Rendsburg (Schleswig- Holstein) nach Berlin gekommen war. Markant sind unter anderem der rot/ blaue Schlafsack und der Hund des Verstorbenen.",Dead in the park – 1st homicide squad asks for help - 5000 Euro reward
28.09.2017 12:25 Uhr,Mutter und Kind angefahren – 8. Mordkommission sucht Zeugen,https://www.berlin.de/polizei/polizeimeldungen/pressemitteilung.633033.php,Ereignisort:Friedrichshain-Kreuzberg,"Nr. 2223
Die Ermittler suchen weitere Zeugen des versuchten Mordes vom 21. September 2017, bei dem ein BMW-Fahrer eine Mutter mit ihrem Kind lebensgefährlich verletzte.
Die 8. Mordkommission fragt:
Wer kann Angaben zu diesem Zusammenstoß machen?
Wer hat den BMW im Tatzeitraum bemerkt und kann Angaben zu den Insassen machen?
Zeugen werden gebeten, sich mit der 8. Mordkommission beim Landeskriminalamt, Keithstraße 30, 10787 Berlin, unter der Rufnummer (030) 4664-911888, per
Email
oder jeder anderen Polizeidienststelle in Verbindung zu setzen.
Erstmeldung Nr. 2176 vom 21. September 2017: Mutter und Kind beim Überqueren der Fahrbahn von Auto erfasst
Beim Überqueren der Fahrbahn heute früh in Kreuzberg wurden eine Mutter und ihr Kind von einem Auto erfasst und schwer verletzt. Derzeitigen Ermittlungen zufolge fuhr ein 32-jähriger Fahrer eines BMW in der Oranienstraße in Richtung Skalitzer Straße. Laut Aussage von Zeugen soll der Mann mit überhöhter Geschwindigkeit unterwegs gewesen sein und gegen 8 Uhr die 27-jährige Mutter mit ihrer fünfjährigen Tochter erfasst haben. Passanten teilten der Polizei später mit, dass beide die Fahrbahn der Oranienstraße bei Grün überquert haben sollen. Der 32-Jährige flüchtete vom Unfallort und wurde wenig später von Polizisten in der Görlitzer Straße Ecke Lübbener Straße gestellt. Polizisten wollten kurz vor dem Unfall in der Oranienstraße in Höhe der Adalbertstraße den Mann überprüfen, woraufhin er in seinem Pkw mit weit überhöhter Geschwindigkeit davon gerast sein soll. Derzeit wird geprüft, ob der Tatverdächtige unter dem Einfluss von Drogen und Alkohol stand.
    Die 8. Mordkommission des Landeskriminalamtes führt die Ermittlungen wegen des Verdachts des versuchten Mordes.",Mother and child hit – 8th homicide squad looking for witnesses
10.07.2017 13:39 Uhr,Angriff auf Rolltreppe,https://www.berlin.de/polizei/polizeimeldungen/pressemitteilung.555517.php,Ereignisort:Mitte,"Nr. 1546
Die Polizei sucht nach einem Mann, der mit einem mutmaßlichen Komplizen am späten Abend des 27. Januar 2017 drei Männer auf einer Rolltreppe des U-Bahnhofes Gesundbrunnen angegriffen haben soll.",Escalator Attack
19.05.2017 13:44 Uhr,Toter Säugling wird beigesetzt – Ermittlungen dauern an – Belohnung ausgelobt,https://www.berlin.de/polizei/polizeimeldungen/pressemitteilung.456317.php,Ereignisort:Lichtenberg,"Gemeinsame Meldung Polizei und Staatsanwaltschaft Berlin
Nr. 1132
Das am 8. März 2016 auf dem ehemaligen Friedhofsgelände in der Ruschestraße 9 in Lichtenberg gefundene Baby wird am Montag, 22. Mai 2017 um 14 Uhr beigesetzt. Nach Abschluss sämtlicher kriminaltechnischer Untersuchungen, wird nunmehr das kleine Mädchen auf dem St. Pius-Friedhof in der Konrad-Wolf-Straße 31-32 in 13055 Berlin-Hohenschönhausen seine letzte Ruhestätte finden.
Somit wird jedem die Gelegenheit gegeben, sich persönlich von dem kleinen Kind im Rahmen einer würdevollen Trauerfeier zu verabschieden.
Die Ermittler der 7. Mordkommission des Landeskriminalamtes sind weiterhin mit der Aufklärung des Falles beschäftigt und bitten weiterhin um die Mithilfe der Bevölkerung:
Wer hat in der Zeit vom 6. bis zum 8. März 2016 Beobachtungen im Bereich der genannten Grünanlage gemacht?
Wer kann Angaben zur Herkunft des getöteten Säuglings machen?
Wer hat im oben angegebenen Zeitraum Personen in der Grünanlage oder in der näheren Umgebung mit einem blauen Plastikmüllsack gesehen?
Wer kennt Frauen, die Ende Februar/Anfang März 2016 schwanger waren, danach aber nicht mit einem Baby gesehen wurden oder eine Schwangerschaft
kaschiert haben könnten?
Welche Frau war ab Anfang März 2016 wegen möglicher Beschwerden, die auf eine nicht fachgerechte Geburt hindeuten, in ärztlicher Behandlung?
Wer kennt Personen, die im Besitz der abgebildeten Handtücher waren und nun nicht mehr sind?
Wer weiß, wo derartige Handtücher vertrieben werden oder wurden?
Wer kann sonstige sachdienliche Hinweise geben?
Hinweise bitte an die 7. Mordkommission in der Keithstraße 30 in Berlin–Tiergarten unter der Telefonnummer (030) 4664 911 777 oder an eine andere Polizeidienststelle.
Gemeinsame Meldung Polizei und Staatsanwaltschaft Berlin Nr. 0736 vom 29. März 2017: Totes Baby in Lichtenberg – Massenspeicheltest und neue Erkenntnisse
Im Fall eines im März 2016 aufgefundenen toten Säuglings in Lichtenberg führten die Ermittlungen inzwischen zu neuen Erkenntnissen. Im Zuge dessen bittet die 7. Mordkommission erneut um Hinweise aus der Bevölkerung.
Am 8. März 2016 gegen 14.40 Uhr hatte ein Passant auf dem ehemaligen Friedhofsgelände in der Ruschestraße 9 in 10367 Berlin-Lichtenberg einen blauen Müllsack im Gebüsch gefunden, in dem sich, in zwei Handtücher eingewickelt, der Leichnam eines Säuglings befand. Die bisherigen Ermittlungen führten nicht zur Namhaftmachung von Tatverdächtigen.
Umfangreiche und zeitaufwändige molekulargenetische Untersuchungen erbrachten inzwischen weitere Erkenntnisse über die noch unbekannte Mutter des Kindes. Demnach dürfte diese die meiste Zeit ihres Lebens nicht in Deutschland verbracht haben. Am ehesten ist davon auszugehen, dass sie aus dem südosteuropäischen Raum stammt und erst einige Jahre vor der Geburt des Säuglings in die Region Berlin kam.
Aufgrund dieser neuen Erkenntnisse wurde durch die Staatsanwaltschaft Berlin ein richterlicher Beschluss zur Durchführung einer DNA-Reihenuntersuchung (sog. Massenspeicheltest) bei sämtlichen Frauen und Mädchen, die aus Südosteuropa stammten, im Bezirk Lichtenberg wohnen oder wohnten und im gebärfähigen Alter sind, erwirkt.
Hierzu wurden durch die 7. Mordkommission über 1600 Frauen und Mädchen schriftlich für die 14. Kalenderwoche (3. bis 6. April 2017), zur Abgabe einer Speichelprobe, vorgeladen. Der „Massenspeicheltest“ wird in unmittelbarer Nähe vom Fundort des toten Säuglings in der DRK-Notunterkunft, Ruschestraße 104, in 10365 Berlin, durchgeführt.
Weitere kriminaltechnische Untersuchungen haben außerdem ergeben, dass die Mutter des toten Kindes vermutlich in einem Haushalt gewohnt haben dürfte, in dem eine dunkel getigerte Hauskatze gelebt hat.
Polizeimeldung Nr. 2358 vom 19. September 2016: Totes Baby in Lichtenberg – 5.000 Euro Belohnung ausgelobt
Am 8. März 2016 gegen 14.40 Uhr hatte ein Passant auf dem ehemaligen Friedhofsgelände in der Ruschestraße 9 in 10367 Berlin-Lichtenberg einen blauen Müllsack im Gebüsch gefunden, in dem sich, in zwei Handtücher eingewickelt, der Leichnam eines Säuglings befand. Die bisherigen Ermittlungen führten nicht zur Namhaftmachung von Tatverdächtigen.
Nun hat die Staatsanwaltschaft Berlin eine Belohnung ausgesetzt. Für Hinweise, die zur Identifizierung der Kindesmutter beziehungsweise zur Aufklärung der Straftat führen, ist eine Belohnung in Höhe von bis zu 5.000 Euro (fünftausend Euro) ausgelobt worden.
Die Belohnung ist ausschließlich für Personen aus der Bevölkerung bestimmt, nicht für solche, zu deren Berufspflichten die Verfolgung von Straftaten gehört. Personen, die an der Tat beteiligt waren, sind von einer Zuteilung ausgeschlossen. Die Verteilung der Belohnung findet unter Ausschluss des Rechtsweges statt.",Dead Infant Buried – Investigations Continue – Reward Offered
26.03.2017 11:05 Uhr,Radfahrer verstorben,https://www.berlin.de/polizei/polizeimeldungen/pressemitteilung.576045.php,Ereignisort:Friedrichshain-Kreuzberg,"Nr. 0694
Zu einem tödlichen Verkehrsunfall kam es gestern Abend in Kreuzberg. Nach bisherigen Erkenntnissen war ein 29-Jähriger gegen 19.10 Uhr mit einem Sattelzug in der Yorckstraße in Richtung Gneisenaustraße unterwegs. Am Mehringdamm bog der Kraftfahrer nach rechts in Richtung Platz der Luftbrücke ab und erfasste mit dem Sattelzug einen 80 Jahre alten Radfahrer, der in gleicher Richtung unterwegs war und offenbar geradeaus den Mehringdamm überqueren wollte. Der Senior erlag seinen schweren Verletzungen am Unfallort. Während der Unfallaufnahme waren die Yorckstraße ab Großbeerenstraße und der Mehringdamm von der Yorckstraße bis zur Hagelberger Straße bis 0.15 Uhr gesperrt. Der Verkehrsermittlungsdienst der Polizeidirektion 5 übernahm die Unfallbearbeitung.",Cyclist Deceased
25.03.2017 13:59 Uhr,Raub im Supermarkt,https://www.berlin.de/polizei/polizeimeldungen/pressemitteilung.576043.php,Ereignisort:Charlottenburg-Wilmersdorf,"Nr. 0693
Zwei Unbekannte haben heute früh eine Angestellte eines Supermarktes in Wilmersdorf überfallen. Die beiden Maskierten überraschten die 24-jährige Verkäuferin gegen 5.15 Uhr, als sie den Nebeneingang des Lebensmittelgeschäftes in der Berliner Straße aufschloss. Die junge Frau wurde genötigt, das Wechselgeld aus dem Büro herauszugeben. Anschließend stießen sie die Männer zu Boden und flüchteten in unbekannte Richtung. Die Angestellte erlitt einen Schock und musste ambulant behandelt werden.",Im Supermarkt
